[
    {
        "id": 1403832,
        "dateOccurred": "2016-01-01T00:56:45-05:00",
        "type": "car",
        "location": {
            "latitude": 42.300864811284519,
            "longitude": -71.071316786983303
        },
        "address": "14 Corona Street",
        "summary": "REPORTED INJURIES (P) (E) (F)"
    },
    {
        "id": 1410434,
        "dateOccurred": "2016-01-04T15:11:11-05:00",
        "type": "pedestrian",
        "location": {
            "latitude": 42.332547160943271,
            "longitude": -71.072124196868316
        },
        "summary": "PEDESTRIAN STRUCK (P) (E) (F)"
    },
    {
        "id": 1410816,
        "dateOccurred": "2016-01-04T18:42:24-05:00",
        "type": "car",
        "location": {
            "latitude": 42.311376108568268,
            "longitude": -71.081614220307372
        },
        "address": "67 Brunswick Street, Boston",
        "summary": "UNKNOWN IF INJURIES - ADVISE NEED FOR EMS (P) (E) (F)"
    }
]
